{
  "witness_id": "urn:telic:hi2:witness:a2102be2-c5b7-5713-8784-1d125926eb51",
  "witness_version": "1",
  "decision_scope": {
    "domain": "community relief intake redesign",
    "period": "initial decision"
  },
  "event_range": {
    "from": "urn:telic:hi2:event:001",
    "to": "urn:telic:hi2:event:009"
  },
  "source_objects": [
    "program-charter",
    "accessibility-policy",
    "community-interviews",
    "staff-capacity"
  ],
  "operative_projections": [
    "access-goal",
    "cost-goal",
    "speed-goal",
    "urn:telic:hi2:condition:d2d278e8-dbe7-52f5-8ca7-961e6bb18fec"
  ],
  "field_classifications": [
    "urn:telic:hi2:classification:4304817c-10e9-537f-b32c-7761e5ed08f2",
    "urn:telic:hi2:protected-review:31609f6d-adce-5395-a59c-a89d83077fb7"
  ],
  "routes_generated": [
    "urn:telic:hi2:route:ae04caed-542c-5063-9c57-f0655ccd3415",
    "urn:telic:hi2:route:1e9f1110-ca44-55ac-a316-ed519c459929",
    "urn:telic:hi2:route:8b779c54-adb6-52b2-b515-f5aa082dc813"
  ],
  "cost_bearers": [
    "urn:telic:hi2:cost:88007731-f2ae-583c-ac68-87a84ff1831a",
    "urn:telic:hi2:cost:0ce3b023-c657-5451-bd5f-5bd7f2f56651",
    "urn:telic:hi2:cost:56903732-e3c6-556d-b13b-d654333e6f91"
  ],
  "protected_condition_reviews": [
    "urn:telic:hi2:protected-review:31609f6d-adce-5395-a59c-a89d83077fb7"
  ],
  "decision_rules": [
    "urn:telic:hi2:decision-rule:52131234-9d6a-5fcd-8757-0a7df8cc1332",
    "urn:telic:hi2:decision-rule:3bcd6aab-f1f5-5667-9f42-a051a5bf841b"
  ],
  "gate_results": [
    "urn:telic:hi2:gate:671177f5-4d0e-5786-b506-b790db05714d",
    "urn:telic:hi2:gate:f1d00205-34fc-5fd4-9a2c-11f3597706c6"
  ],
  "recommendations": [
    "urn:telic:hi2:recommendation:d784bb94-b9f4-50bf-bbe9-9a97a9f95ac3"
  ],
  "selected_route": "urn:telic:hi2:route:8b779c54-adb6-52b2-b515-f5aa082dc813",
  "dissent": [
    "Some staff prefer one standardized channel."
  ],
  "unresolved": [
    "Long-term cost of maintaining both channels."
  ],
  "authority": [
    {
      "holder": "program-director",
      "operation": "authorize"
    }
  ],
  "actions": [],
  "consequences": [],
  "corrections": [],
  "completeness": "complete_for_scope",
  "known_gaps": [],
  "generated_from_events": true,
  "event_ids": [
    "urn:telic:hi2:event:001",
    "urn:telic:hi2:event:002",
    "urn:telic:hi2:event:003",
    "urn:telic:hi2:event:004",
    "urn:telic:hi2:event:005",
    "urn:telic:hi2:event:006",
    "urn:telic:hi2:event:007",
    "urn:telic:hi2:event:008",
    "urn:telic:hi2:event:009"
  ],
  "generated_at": "2026-07-15T09:23:00Z"
}
